{
  "$schema": "https://json-schema.org/draft/2020-12/schema",
  "title": "CheckoutScenarioInput",
  "description": "A named setup of the local checkout: a file of `checkouts/`. It sets what a checkout\ndepends on on top of the store data, and what it does not set stays as the store data says.",
  "type": "object",
  "properties": {
    "$schema": {
      "description": "Lets editors validate and autocomplete the file, e.g.\n`\"../schema/checkout-scenario.schema.json\"`.",
      "type": [
        "string",
        "null"
      ]
    },
    "title": {
      "description": "The name shown on the home page. Defaults to the name of the file.",
      "type": [
        "string",
        "null"
      ],
      "default": null
    },
    "description": {
      "description": "What the scenario is for and what to look at, shown on the home page.",
      "type": [
        "string",
        "null"
      ],
      "default": null
    },
    "session": {
      "description": "Who buys and what is in the cart, written as the `session` of the store data and applied\non top of it: `customer`, `cart` (lines, quantities, selling plans, note, attributes),\n`country`, `company_location`.",
      "anyOf": [
        {
          "$ref": "#/$defs/SessionInput"
        },
        {
          "type": "null"
        }
      ],
      "default": null
    },
    "entered": {
      "description": "What the buyer already entered: email, address, discount codes, delivery and payment.",
      "anyOf": [
        {
          "$ref": "#/$defs/ScenarioEnteredInput"
        },
        {
          "type": "null"
        }
      ],
      "default": null
    },
    "language": {
      "description": "The language of the buyer, by ISO code (`\"fr\"`): one of `localization.languages`. The\ncheckout opens under its locale root. Defaults to the primary language.",
      "type": [
        "string",
        "null"
      ],
      "default": null
    },
    "checkout": {
      "description": "Overrides of the `checkout` section of the store data: every field that is present\nreplaces the one of the store (`shipping_rates`, `payment_methods`, `discounts`,\n`tax_rate`), except `functions`, which replaces the settings of the Functions it names.",
      "anyOf": [
        {
          "$ref": "#/$defs/CheckoutInput"
        },
        {
          "type": "null"
        }
      ],
      "default": null
    },
    "variant": {
      "description": "The look of the page. Defaults to the one of the server (`--variant`).",
      "anyOf": [
        {
          "$ref": "#/$defs/ScenarioLook"
        },
        {
          "type": "null"
        }
      ],
      "default": null
    },
    "extensions": {
      "description": "The handles of the extensions (Functions and checkout UI extensions) that run, among\nthose of the app that `--extension` allows. Every one when omitted.",
      "type": [
        "array",
        "null"
      ],
      "items": {
        "type": "string"
      },
      "default": null
    }
  },
  "additionalProperties": false,
  "$defs": {
    "SessionInput": {
      "description": "The state a browser session starts with. Tests can replace it per session through the\ncontrol API (`PUT /__lsf/session`).",
      "type": "object",
      "properties": {
        "$schema": {
          "description": "Lets editors validate and autocomplete the file, e.g. `\"../schema/session.schema.json\"`.",
          "type": [
            "string",
            "null"
          ]
        },
        "customer": {
          "description": "Who is logged in: the email of a customer, `\"default\"` for the first customer of the\ndata, or `\"none\"`. Nobody is logged in when omitted.",
          "type": [
            "string",
            "null"
          ],
          "default": null
        },
        "cart": {
          "description": "The content of the cart. Empty when omitted.",
          "anyOf": [
            {
              "$ref": "#/$defs/CartInput"
            },
            {
              "type": "null"
            }
          ],
          "default": null
        },
        "country": {
          "description": "ISO code of the selected country. Defaults to the first country.",
          "type": [
            "string",
            "null"
          ],
          "default": null
        },
        "company_location": {
          "description": "For a B2B customer: the name of the company location they buy for. Defaults to the\nfirst one they have access to.",
          "type": [
            "string",
            "null"
          ],
          "default": null
        }
      },
      "additionalProperties": false
    },
    "CartInput": {
      "description": "The cart a session starts with.",
      "type": "object",
      "properties": {
        "items": {
          "type": "array",
          "items": {
            "$ref": "#/$defs/CartLineInput"
          },
          "default": []
        },
        "note": {
          "type": [
            "string",
            "null"
          ],
          "default": null
        },
        "attributes": {
          "description": "Cart attributes.",
          "type": "object",
          "additionalProperties": {
            "type": "string"
          },
          "default": {}
        }
      },
      "additionalProperties": false
    },
    "CartLineInput": {
      "description": "A line of the cart a session starts with.",
      "type": "object",
      "properties": {
        "variant": {
          "description": "A variant, by id or SKU, or a product handle (its first variant is used).",
          "$ref": "#/$defs/VariantRef"
        },
        "quantity": {
          "description": "Defaults to 1.",
          "type": "integer",
          "format": "uint32",
          "minimum": 0,
          "default": 1
        },
        "properties": {
          "description": "Line item properties, e.g. `{\"Engraving\": \"Hello\"}`.",
          "type": "object",
          "additionalProperties": {
            "type": "string"
          },
          "default": {}
        },
        "selling_plan": {
          "description": "The selling plan the line is bought with: its name or its id. The product of the\nvariant must be sold with it.",
          "anyOf": [
            {
              "$ref": "#/$defs/SellingPlanRef"
            },
            {
              "type": "null"
            }
          ],
          "default": null
        }
      },
      "additionalProperties": false,
      "required": [
        "variant"
      ]
    },
    "VariantRef": {
      "description": "A reference to a variant: its numeric id, its SKU, or a product handle (meaning that\nproduct's first variant).",
      "anyOf": [
        {
          "type": "integer",
          "format": "uint64",
          "minimum": 0
        },
        {
          "type": "string"
        }
      ]
    },
    "SellingPlanRef": {
      "description": "A reference to a selling plan: its numeric id, or its name.",
      "anyOf": [
        {
          "type": "integer",
          "format": "uint64",
          "minimum": 0
        },
        {
          "type": "string"
        }
      ]
    },
    "ScenarioEnteredInput": {
      "description": "What the buyer already typed and chose when a scenario opens.",
      "type": "object",
      "properties": {
        "email": {
          "description": "The contact email. A logged-in customer has theirs already.",
          "type": [
            "string",
            "null"
          ],
          "default": null
        },
        "phone": {
          "type": [
            "string",
            "null"
          ],
          "default": null
        },
        "shipping_address": {
          "description": "The delivery address. Its country is the country of the checkout.",
          "anyOf": [
            {
              "$ref": "#/$defs/ScenarioAddressInput"
            },
            {
              "type": "null"
            }
          ],
          "default": null
        },
        "delivery": {
          "description": "The handle of the shipping rate chosen (`checkout.shipping_rates`). The first one\navailable is chosen when omitted.",
          "type": [
            "string",
            "null"
          ],
          "default": null
        },
        "payment": {
          "description": "The handle of the payment method chosen (`checkout.payment_methods`).",
          "type": [
            "string",
            "null"
          ],
          "default": null
        },
        "discount_codes": {
          "description": "The discount codes entered, in order. A code that no discount of `checkout.discounts`\nhas is entered all the same, and refused as on Shopify.",
          "type": "array",
          "items": {
            "type": "string"
          },
          "default": []
        }
      },
      "additionalProperties": false
    },
    "ScenarioAddressInput": {
      "description": "A postal address the buyer already entered.",
      "type": "object",
      "properties": {
        "first_name": {
          "type": [
            "string",
            "null"
          ],
          "default": null
        },
        "last_name": {
          "type": [
            "string",
            "null"
          ],
          "default": null
        },
        "company": {
          "type": [
            "string",
            "null"
          ],
          "default": null
        },
        "address1": {
          "type": [
            "string",
            "null"
          ],
          "default": null
        },
        "address2": {
          "type": [
            "string",
            "null"
          ],
          "default": null
        },
        "city": {
          "type": [
            "string",
            "null"
          ],
          "default": null
        },
        "country_code": {
          "description": "ISO 3166-1 alpha-2 code of one of the store's countries: `\"US\"`.",
          "type": [
            "string",
            "null"
          ],
          "default": null
        },
        "province_code": {
          "type": [
            "string",
            "null"
          ],
          "default": null
        },
        "zip": {
          "type": [
            "string",
            "null"
          ],
          "default": null
        },
        "phone": {
          "type": [
            "string",
            "null"
          ],
          "default": null
        }
      },
      "additionalProperties": false
    },
    "CheckoutInput": {
      "description": "How the local checkout (`lsf app dev --app`) is set up. Every field has a default.",
      "type": "object",
      "properties": {
        "shipping_rates": {
          "description": "The delivery options offered to every address. Defaults to one, \"Standard\" at 5.00.",
          "type": [
            "array",
            "null"
          ],
          "items": {
            "$ref": "#/$defs/CheckoutShippingRateInput"
          },
          "default": null
        },
        "payment_methods": {
          "description": "The payment methods. Defaults to \"Credit card\", \"Cash on Delivery\" and \"Bank Deposit\".",
          "type": [
            "array",
            "null"
          ],
          "items": {
            "$ref": "#/$defs/CheckoutPaymentMethodInput"
          },
          "default": null
        },
        "discounts": {
          "description": "Discounts backed by discount Functions of the app.",
          "type": [
            "array",
            "null"
          ],
          "items": {
            "$ref": "#/$defs/CheckoutDiscountInput"
          },
          "default": null
        },
        "functions": {
          "description": "The settings of the other Functions, by the handle of the Function.",
          "type": "object",
          "additionalProperties": {
            "$ref": "#/$defs/CheckoutFunctionInput"
          },
          "default": {}
        },
        "tax_rate": {
          "description": "Tax in percent, added on top of the discounted subtotal: `20` for 20 %. No tax when\nomitted.",
          "type": [
            "number",
            "null"
          ],
          "format": "double",
          "default": null
        }
      },
      "additionalProperties": false
    },
    "CheckoutShippingRateInput": {
      "description": "A delivery option the local checkout offers to every address.",
      "type": "object",
      "properties": {
        "handle": {
          "description": "What Functions and the page call the option: `\"standard\"`.",
          "type": "string"
        },
        "title": {
          "description": "What the buyer sees. Defaults to the handle.",
          "type": [
            "string",
            "null"
          ],
          "default": null
        },
        "price": {
          "description": "The cost, e.g. `\"4.90\"`.",
          "$ref": "#/$defs/Money"
        },
        "description": {
          "type": [
            "string",
            "null"
          ],
          "default": null
        },
        "kind": {
          "description": "Defaults to `\"shipping\"`.",
          "anyOf": [
            {
              "$ref": "#/$defs/CheckoutDeliveryKind"
            },
            {
              "type": "null"
            }
          ],
          "default": null
        }
      },
      "additionalProperties": false,
      "required": [
        "handle",
        "price"
      ]
    },
    "Money": {
      "description": "An amount of money: an integer number of cents (`1999`, the unit Liquid uses) or a decimal string in the shop currency (`\"19.99\"`). Floats such as `19.99` are rejected because they are ambiguous.",
      "anyOf": [
        {
          "description": "Cents, e.g. 1999 for 19.99.",
          "type": "integer"
        },
        {
          "description": "Decimal amount, e.g. \"19.99\" or \"20\".",
          "type": "string",
          "pattern": "^-?\\d+(\\.\\d{1,2})?$"
        }
      ]
    },
    "CheckoutDeliveryKind": {
      "description": "What kind of delivery a shipping rate is.",
      "oneOf": [
        {
          "description": "Delivered to the address.",
          "type": "string",
          "const": "shipping"
        },
        {
          "description": "Picked up in a store.",
          "type": "string",
          "const": "pick_up"
        },
        {
          "description": "Delivered locally.",
          "type": "string",
          "const": "local"
        }
      ]
    },
    "CheckoutPaymentMethodInput": {
      "description": "A payment method the local checkout offers.",
      "type": "object",
      "properties": {
        "handle": {
          "description": "What payment customization Functions and the page call the method: `\"card\"`.",
          "type": "string"
        },
        "name": {
          "description": "What the buyer sees. Defaults to the handle.",
          "type": [
            "string",
            "null"
          ],
          "default": null
        },
        "placements": {
          "description": "Where the method is offered, which payment customization Functions read as\n`placements`. Defaults to `[\"PAYMENT_METHOD\"]`: the list of the checkout.",
          "type": "array",
          "items": {
            "$ref": "#/$defs/CheckoutPaymentPlacement"
          },
          "default": []
        }
      },
      "additionalProperties": false,
      "required": [
        "handle"
      ]
    },
    "CheckoutPaymentPlacement": {
      "description": "Where a payment method is offered.",
      "oneOf": [
        {
          "description": "The list of payment methods of the checkout.",
          "type": "string",
          "const": "PAYMENT_METHOD"
        },
        {
          "description": "The express buttons (Shop Pay, Apple Pay, ...).",
          "type": "string",
          "const": "ACCELERATED_CHECKOUT"
        }
      ]
    },
    "CheckoutDiscountInput": {
      "description": "A discount backed by a discount Function of the app.",
      "type": "object",
      "properties": {
        "function": {
          "description": "The handle of the discount Function in the app.",
          "type": "string"
        },
        "title": {
          "description": "What the buyer sees. Defaults to the handle of the Function.",
          "type": [
            "string",
            "null"
          ],
          "default": null
        },
        "code": {
          "description": "The code that triggers the discount. Without one the discount is automatic.",
          "type": [
            "string",
            "null"
          ],
          "default": null
        },
        "classes": {
          "description": "What the discount may reduce. All three when omitted.",
          "type": "array",
          "items": {
            "$ref": "#/$defs/CheckoutDiscountClass"
          },
          "default": []
        },
        "metafields": {
          "description": "The metafields of the discount, which its Function's input query reads, by\n`\"namespace.key\"`: `{\"$app:config.settings\": {\"type\": \"json\", \"value\": {\"percent\": 10}}}`.",
          "type": "object",
          "additionalProperties": {
            "$ref": "#/$defs/MetafieldInput"
          },
          "default": {}
        }
      },
      "additionalProperties": false,
      "required": [
        "function"
      ]
    },
    "CheckoutDiscountClass": {
      "description": "What a discount may reduce.",
      "type": "string",
      "enum": [
        "PRODUCT",
        "ORDER",
        "SHIPPING"
      ]
    },
    "MetafieldInput": {
      "description": "A metafield value. Write the value directly and its type is inferred (string →\n`single_line_text_field`, integer → `number_integer`, decimal → `number_decimal`, boolean →\n`boolean`, anything else → `json`), or spell out `{\"type\": ..., \"value\": ...}`.",
      "anyOf": [
        {
          "$ref": "#/$defs/TypedMetafield"
        },
        true
      ]
    },
    "TypedMetafield": {
      "description": "A metafield with an explicit type.",
      "type": "object",
      "properties": {
        "type": {
          "description": "A Shopify metafield type, e.g. `single_line_text_field`, `multi_line_text_field`,\n`rich_text_field`, `number_integer`, `number_decimal`, `boolean`, `color`, `date`,\n`date_time`, `url`, `json`, `money`, `rating`, `weight`, `volume`, `dimension` and the\nother measurements (`distance`, `temperature`, `duration`...), `product_reference`,\n`collection_reference`, `page_reference`, `article_reference` (`blog/article`, or the\narticle's handle alone), `file_reference`, `metaobject_reference`, or a `list.` variant\nof those.",
          "type": "string"
        },
        "value": {
          "description": "The value. References are written as handles (`\"blue-shirt\"`), files as paths inside\n`files/`, lists as JSON arrays."
        }
      },
      "additionalProperties": false,
      "required": [
        "type",
        "value"
      ]
    },
    "CheckoutFunctionInput": {
      "description": "The settings of a Function that is not a discount: cart transform, delivery or payment\ncustomization, validation.",
      "type": "object",
      "properties": {
        "metafields": {
          "description": "The metafields of the object the Function belongs to, by `\"namespace.key\"`.",
          "type": "object",
          "additionalProperties": {
            "$ref": "#/$defs/MetafieldInput"
          },
          "default": {}
        }
      },
      "additionalProperties": false
    },
    "ScenarioLook": {
      "description": "The look of the checkout page.",
      "oneOf": [
        {
          "description": "Shopify's one-page checkout.",
          "type": "string",
          "const": "standard"
        },
        {
          "description": "The look of the Shop app and Shop Pay.",
          "type": "string",
          "const": "shop"
        }
      ]
    }
  }
}
