{
  "$schema": "../schema/checkout-scenario.schema.json",
  "title": "UI: translations, in French",
  "description": "The same extension with language fr: strings from locales/fr.json, French plurals and formats, a key only English has (falls back) and one no file has (shows the key).",
  "session": {
    "customer": "camille.martin@example.com",
    "country": "FR",
    "cart": {
      "items": [
        {
          "variant": "TOTE-NAT",
          "quantity": 1
        },
        {
          "variant": "MUG-OAT",
          "quantity": 2
        }
      ]
    }
  },
  "language": "fr",
  "extensions": [
    "ui-i18n-greeting",
    "ui-header-notice"
  ]
}
