{
  "$schema": "../schema/checkout-scenario.schema.json",
  "title": "A guest, one line",
  "description": "The plainest checkout: nobody is logged in, one line, nothing entered yet.",
  "session": {
    "customer": "none",
    "cart": {
      "items": [
        {
          "variant": "TOTE-NAT",
          "quantity": 1
        }
      ]
    }
  },
  "extensions": [
    "cart-transform-expand",
    "cart-transform-legacy",
    "cart-transform-merge",
    "cart-transform-properties",
    "cart-transform-update",
    "delivery-hide-express",
    "delivery-legacy",
    "delivery-rename-by-language",
    "delivery-reorder",
    "discount-b2b-location",
    "discount-buy-two-get-one",
    "discount-by-market",
    "discount-codes",
    "discount-free-shipping",
    "discount-from-metafields",
    "discount-legacy-order",
    "discount-legacy-product",
    "discount-legacy-shipping",
    "discount-lines-and-shipping",
    "discount-order-fixed",
    "discount-shipping-amount",
    "discount-tag-percentage",
    "discount-vip-customer",
    "payment-hide-cod",
    "payment-hide-for-b2b",
    "payment-legacy",
    "payment-rename",
    "payment-reorder",
    "validation-blocked-country",
    "validation-gift-note",
    "validation-legacy",
    "validation-max-quantity",
    "validation-minimum-order",
    "validation-street-number",
    "ui-header-notice",
    "ui-contact-newsletter",
    "ui-address-autofill",
    "ui-shipping-options",
    "ui-payment-notes",
    "ui-reductions-codes",
    "ui-line-properties",
    "ui-order-summary",
    "ui-footer-links",
    "ui-gift-wrap",
    "ui-upsell",
    "ui-note-attributes",
    "ui-thank-you"
  ]
}
