{
  "$schema": "../schema/checkout-scenario.schema.json",
  "title": "A large cart",
  "description": "Many units on several lines: quantity limits, amount thresholds, free shipping, volume discounts.",
  "session": {
    "cart": {
      "items": [
        {
          "variant": "TOTE-NAT",
          "quantity": 12
        },
        {
          "variant": "MUG-OAT",
          "quantity": 8
        },
        {
          "variant": "OVS-S",
          "quantity": 5
        },
        {
          "variant": "SOCK-S",
          "quantity": 3
        }
      ]
    }
  },
  "extensions": [
    "cart-transform-expand",
    "cart-transform-merge",
    "cart-transform-properties",
    "cart-transform-update",
    "delivery-hide-express",
    "delivery-rename-by-language",
    "delivery-reorder",
    "discount-b2b-location",
    "discount-buy-two-get-one",
    "discount-by-market",
    "discount-codes",
    "discount-free-shipping",
    "discount-from-metafields",
    "discount-lines-and-shipping",
    "discount-order-fixed",
    "discount-shipping-amount",
    "discount-tag-percentage",
    "discount-typescript",
    "discount-vip-customer",
    "payment-hide-cod",
    "payment-hide-for-b2b",
    "payment-rename",
    "payment-reorder",
    "validation-blocked-country",
    "validation-gift-note",
    "validation-max-quantity",
    "validation-minimum-order",
    "validation-street-number",
    "ui-header-notice",
    "ui-contact-newsletter",
    "ui-address-autofill",
    "ui-shipping-options",
    "ui-payment-notes",
    "ui-reductions-codes",
    "ui-line-properties",
    "ui-order-summary",
    "ui-footer-links",
    "ui-gift-wrap",
    "ui-upsell",
    "ui-note-attributes",
    "ui-thank-you"
  ]
}
